{"schema":"tablet-layout-c1a-sidecar/v1","run_id":"tl1-c1a-20260826t125127z-354a7b4b0ed5","completed_at_utc":"2026-08-26T12:52:13.1993571Z","expected_commit_sha":"4b96f89a6622eb8b5fe04bd249571c7d77936b25","provenance_strategy":"clean_port_content_attested","static_read_only_policy_version":"tl1-c1a-read-only/v1","trusted_blobs":[{"path":"app/gateway/src/main/java/dev/magina/gateway/tablet/AndroidTabletLayoutProbeSource.kt","blob_oid":"cf5f625650d81e830da8e03b2ee8ebf5ce309b7a"},{"path":"app/gateway/src/main/java/dev/magina/gateway/tablet/TabletLayoutProbe.kt","blob_oid":"b7b35d1d0c4c1787f1f254224c8ac13ee1668cf7"},{"path":"app/gateway/src/main/java/dev/magina/gateway/tablet/TabletLayoutProbeModel.kt","blob_oid":"283eb71675605444c5f829aea9b1c9fd9bd65db0"},{"path":"app/gateway/src/test/java/dev/magina/gateway/tablet/TabletLayoutProbeTest.kt","blob_oid":"70843bb488041c5e21204f973c4dbcac526a126e"},{"path":"scripts/lib/tablet-intake.ps1","blob_oid":"4d33c629b95a13a59bb97bdf1490e1edc74b17b4"},{"path":"scripts/run-tablet-intake.ps1","blob_oid":"572da0c848eefd038ea666d80d741fb73767eb48"}],"implementation_hashes":{"runner_sha256":"sha256:00fa229391f70d4537dd12f2bd9b8924419e02ba590b6907afa646fe115f5c73","c1a_library_sha256":"sha256:0e1a6f2af7742b633540ce85bf563cc2814b234a9d0f2298495862808b22d114","t0_adb_sidecar_cmd_sha256":"sha256:63d4d92f6b9cdde829e0aa17a12376b6d22f9644339635ecc1ddd6b7353469f5","t0_adb_sidecar_script_sha256":"sha256:600c1693c8d5e2402f6b86d4687dfe947306be80761224a521e8d2c592ece93b","validator_sha256":"sha256:eeda8b1f74c477e556ffb08ba49b3813822386189a4ac29321576f6f558f8d7d","sidecar_schema_sha256":"sha256:57007980db0cdc3806d734d9fe765aea5ea885f31befdc6e1e43bdd3f2854e3d"},"producer_baseline_sha":"b5769df7baba075fda47aec17f249a5caa124b92","t0_baseline_sha":"4ca32b131007df58f7752c5ee9b2d049cb1cd54e","title_hash":"sha256:5d3510ec998c991305fcede15b32be9ea1c4061d82ab15a3994a38faa243311c","apk":{"local_sha256_before":"sha256:0f2e5922e5f4c12b03b74fe06b7e0e40aa870ec376eca2cf06a4984ac2e4b288","local_sha256_after":"sha256:0f2e5922e5f4c12b03b74fe06b7e0e40aa870ec376eca2cf06a4984ac2e4b288","installed_base_apk_path_hash_before":"sha256:58e535134c110ad5e057974e1300e21c81bc2b2090d1ec7f461fccd7320c9ddb","installed_base_apk_path_hash_after":"sha256:58e535134c110ad5e057974e1300e21c81bc2b2090d1ec7f461fccd7320c9ddb","installed_base_apk_sha256_before":"sha256:0f2e5922e5f4c12b03b74fe06b7e0e40aa870ec376eca2cf06a4984ac2e4b288","installed_base_apk_sha256_after":"sha256:0f2e5922e5f4c12b03b74fe06b7e0e40aa870ec376eca2cf06a4984ac2e4b288","signer_certificate_sha256":"sha256:ef99efaa844c7c910eafb16eb164ad14594abc7248f73d9a48b1ebeb39969ea1","package_name_before":"dev.magina.gateway","package_name_after":"dev.magina.gateway","version_name_before":"0.1.0-m1a","version_name_after":"0.1.0-m1a","version_code_before":1,"version_code_after":1,"embedded_git_head":"4b96f89a6622eb8b5fe04bd249571c7d77936b25","build_challenge_hash":"sha256:5909fc955d9de7abe01c6a139c786abfa286e45fdf9ff822126f5aaba666d648"},"device":{"serial_hash_before":"sha256:7c883b430943c320285b802d6a40abd360bf550d40ef35a6eb6e9e376539a045","serial_hash_after":"sha256:7c883b430943c320285b802d6a40abd360bf550d40ef35a6eb6e9e376539a045","fingerprint_hash_before":"sha256:32f9f96874c3fc6dc5a532dcbba3cec18337376ef44b27cb9dbcdd67ccbe54df","fingerprint_hash_after":"sha256:32f9f96874c3fc6dc5a532dcbba3cec18337376ef44b27cb9dbcdd67ccbe54df","boot_id_hash_before":"sha256:942bdb6cf66bc8609f512bca13086464005f27973edaca710daa8d03c87d3dfa","boot_id_hash_after":"sha256:942bdb6cf66bc8609f512bca13086464005f27973edaca710daa8d03c87d3dfa","unique_device_before_after":true},"upstream_t0":{"producer_commit_sha":"4ca32b131007df58f7752c5ee9b2d049cb1cd54e","artifact_sha256":"sha256:6f5b1539d3d09bf77e26dc2ba5d700d11857c3edac84eef33fee03df4a81c316","original_bytes_forwarded":true},"capture":{"tokens":["c1","c2"],"host_wait_ms":905,"total_span_ms":3140,"recapture_count":0},"observation":{"artifact_sha256":"sha256:a7be22f5a055045ab455c7a734fbe597062ea9efe20d6cd10bb441719a10a549","relative_path":"tablet-layout-observation-v2.json"},"validation":{"artifact_sha256":"sha256:ad3ced0159f6e53be6bbb8859bf64ce245c5b74e1bc4a14ac30a8e29e157985d","relative_path":"tablet-layout-observation-validation-v2.json"},"c1a_origin_binding_verified":true,"c1a_probe_entrypoint_read_only":true,"observation_schema_valid":true,"mcp_used":false,"dispatch_used":false,"screen_capture_used":false,"settings_mutation_used":false,"target_app_started":false,"cleanup_status":"not_required","runtime_evidence":false,"layout_accepted":false,"wechat_layout_verified":false,"editor_action_ready":false,"p0_capability":"unsupported","execution_grant":false}